Output of `tcpdump -nn -i any -e port 80` from debug container:

tcpdump: WARNING: any: That device doesn't support promiscuous mode
(Promiscuous mode not supported on the "any" device)
tcpdump: verbose output suppressed, use -v[v]... for full protocol decode
listening on any, link-type LINUX_SLL2 (Linux cooked v2), snapshot length 262144 bytes
14:09:46.294907 lo    In  ifindex 1 00:00:00:00:00:00 ethertype IPv4 (0x0800), length 80: 10.112.131.19.59850 > 10.112.131.19.80: Flags [S], seq 977344810, win 65495, options [mss 65495,sackOK,TS val 2705419103 ecr 0,nop,wscale 7], length 0
14:09:46.294921 lo    In  ifindex 1 00:00:00:00:00:00 ethertype IPv4 (0x0800), length 80: 10.112.131.19.80 > 10.112.131.19.59850: Flags [S.], seq 2186453781, ack 977344811, win 65483, options [mss 65495,sackOK,TS val 2705419103 ecr 2705419103,nop,wscale 7], length 0
14:09:46.294931 lo    In  ifindex 1 00:00:00:00:00:00 ethertype IPv4 (0x0800), length 72: 10.112.131.19.59850 > 10.112.131.19.80: Flags [.], ack 1, win 512, options [nop,nop,TS val 2705419103 ecr 2705419103], length 0
14:09:46.294988 lo    In  ifindex 1 00:00:00:00:00:00 ethertype IPv4 (0x0800), length 148: 10.112.131.19.59850 > 10.112.131.19.80: Flags [P.], seq 1:77, ack 1, win 512, options [nop,nop,TS val 2705419103 ecr 2705419103], length 76: HTTP: GET / HTTP/1.1
14:09:46.294992 lo    In  ifindex 1 00:00:00:00:00:00 ethertype IPv4 (0x0800), length 72: 10.112.131.19.80 > 10.112.131.19.59850: Flags [.], ack 77, win 511, options [nop,nop,TS val 2705419103 ecr 2705419103], length 0
14:09:46.295215 lo    In  ifindex 1 00:00:00:00:00:00 ethertype IPv4 (0x0800), length 305: 10.112.131.19.80 > 10.112.131.19.59850: Flags [P.], seq 1:234, ack 77, win 512, options [nop,nop,TS val 2705419103 ecr 2705419103], length 233: HTTP: HTTP/1.1 200 OK
14:09:46.295227 lo    In  ifindex 1 00:00:00:00:00:00 ethertype IPv4 (0x0800), length 72: 10.112.131.19.59850 > 10.112.131.19.80: Flags [.], ack 234, win 511, options [nop,nop,TS val 2705419103 ecr 2705419103], length 0
14:09:46.295245 lo    In  ifindex 1 00:00:00:00:00:00 ethertype IPv4 (0x0800), length 684: 10.112.131.19.80 > 10.112.131.19.59850: Flags [P.], seq 234:846, ack 77, win 512, options [nop,nop,TS val 2705419103 ecr 2705419103], length 612: HTTP
14:09:46.295248 lo    In  ifindex 1 00:00:00:00:00:00 ethertype IPv4 (0x0800), length 72: 10.112.131.19.59850 > 10.112.131.19.80: Flags [.], ack 846, win 507, options [nop,nop,TS val 2705419103 ecr 2705419103], length 0
14:09:46.295288 lo    In  ifindex 1 00:00:00:00:00:00 ethertype IPv4 (0x0800), length 72: 10.112.131.19.80 > 10.112.131.19.59850: Flags [F.], seq 846, ack 77, win 512, options [nop,nop,TS val 2705419103 ecr 2705419103], length 0
14:09:46.295341 lo    In  ifindex 1 00:00:00:00:00:00 ethertype IPv4 (0x0800), length 72: 10.112.131.19.59850 > 10.112.131.19.80: Flags [F.], seq 77, ack 847, win 512, options [nop,nop,TS val 2705419103 ecr 2705419103], length 0
14:09:46.295345 lo    In  ifindex 1 00:00:00:00:00:00 ethertype IPv4 (0x0800), length 72: 10.112.131.19.80 > 10.112.131.19.59850: Flags [.], ack 78, win 512, options [nop,nop,TS val 2705419103 ecr 2705419103], length 0
14:11:23.136616 lo    In  ifindex 1 00:00:00:00:00:00 ethertype IPv4 (0x0800), length 80: 10.112.131.19.33730 > 10.112.131.19.80: Flags [S], seq 1354778344, win 65495, options [mss 65495,sackOK,TS val 2705515945 ecr 0,nop,wscale 7], length 0
14:11:23.136629 lo    In  ifindex 1 00:00:00:00:00:00 ethertype IPv4 (0x0800), length 80: 10.112.131.19.80 > 10.112.131.19.33730: Flags [S.], seq 3847793981, ack 1354778345, win 65483, options [mss 65495,sackOK,TS val 2705515945 ecr 2705515945,nop,wscale 7], length 0
14:11:23.136638 lo    In  ifindex 1 00:00:00:00:00:00 ethertype IPv4 (0x0800), length 72: 10.112.131.19.33730 > 10.112.131.19.80: Flags [.], ack 1, win 512, options [nop,nop,TS val 2705515945 ecr 2705515945], length 0
14:11:23.136696 lo    In  ifindex 1 00:00:00:00:00:00 ethertype IPv4 (0x0800), length 148: 10.112.131.19.33730 > 10.112.131.19.80: Flags [P.], seq 1:77, ack 1, win 512, options [nop,nop,TS val 2705515945 ecr 2705515945], length 76: HTTP: GET / HTTP/1.1
14:11:23.136701 lo    In  ifindex 1 00:00:00:00:00:00 ethertype IPv4 (0x0800), length 72: 10.112.131.19.80 > 10.112.131.19.33730: Flags [.], ack 77, win 511, options [nop,nop,TS val 2705515945 ecr 2705515945], length 0
14:11:23.136799 lo    In  ifindex 1 00:00:00:00:00:00 ethertype IPv4 (0x0800), length 305: 10.112.131.19.80 > 10.112.131.19.33730: Flags [P.], seq 1:234, ack 77, win 512, options [nop,nop,TS val 2705515945 ecr 2705515945], length 233: HTTP: HTTP/1.1 200 OK
14:11:23.136811 lo    In  ifindex 1 00:00:00:00:00:00 ethertype IPv4 (0x0800), length 72: 10.112.131.19.33730 > 10.112.131.19.80: Flags [.], ack 234, win 511, options [nop,nop,TS val 2705515945 ecr 2705419103], length 0
14:11:23.136827 lo    In  ifindex 1 00:00:00:00:00:00 ethertype IPv4 (0x0800), length 684: 10.112.131.19.80 > 10.112.131.19.33730: Flags [P.], seq 234:846, ack 77, win 512, options [nop,nop,TS val 2705515945 ecr 2705515945], length 612: HTTP
14:11:23.136830 lo    In  ifindex 1 00:00:00:00:00:00 ethertype IPv4 (0x0800), length 72: 10.112.131.19.33730 > 10.112.131.19.80: Flags [.], ack 846, win 507, options [nop,nop,TS val 2705515945 ecr 2705515945], length 0
14:11:23.136853 lo    In  ifindex 1 00:00:00:00:00:00 ethertype IPv4 (0x0800), length 72: 10.112.131.19.80 > 10.112.131.19.33730: Flags [F.], seq 846, ack 77, win 512, options [nop,nop,TS val 2705515945 ecr 2705515945], length 0
14:11:23.136855 lo    In  ifindex 1 00:00:00:00:00:00 ethertype IPv4 (0x0800), length 72: 10.112.131.19.33730 > 10.112.131.19.80: Flags [F.], seq 77, ack 846, win 512, options [nop,nop,TS val 2705515945 ecr 2705515945], length 0
14:11:23.136859 lo    In  ifindex 1 00:00:00:00:00:00 ethertype IPv4 (0x0800), length 72: 10.112.131.19.80 > 10.112.131.19.33730: Flags [.], ack 78, win 512, options [nop,nop,TS val 2705515945 ecr 2705515945], length 0
14:11:23.136864 lo    In  ifindex 1 00:00:00:00:00:00 ethertype IPv4 (0x0800), length 72: 10.112.131.19.33730 > 10.112.131.19.80: Flags [.], ack 847, win 512, options [nop,nop,TS val 2705515945 ecr 2705515945], length 0
14:11:40.025214 lo    In  ifindex 1 00:00:00:00:00:00 ethertype IPv4 (0x0800), length 80: 10.112.131.19.49304 > 10.112.131.19.80: Flags [S], seq 2086314352, win 65495, options [mss 65495,sackOK,TS val 2705532833 ecr 0,nop,wscale 7], length 0
14:11:40.025226 lo    In  ifindex 1 00:00:00:00:00:00 ethertype IPv4 (0x0800), length 80: 10.112.131.19.80 > 10.112.131.19.49304: Flags [S.], seq 3423764847, ack 2086314353, win 65483, options [mss 65495,sackOK,TS val 2705532833 ecr 2705532833,nop,wscale 7], length 0
14:11:40.025237 lo    In  ifindex 1 00:00:00:00:00:00 ethertype IPv4 (0x0800), length 72: 10.112.131.19.49304 > 10.112.131.19.80: Flags [.], ack 1, win 512, options [nop,nop,TS val 2705532833 ecr 2705532833], length 0
14:11:40.025297 lo    In  ifindex 1 00:00:00:00:00:00 ethertype IPv4 (0x0800), length 148: 10.112.131.19.49304 > 10.112.131.19.80: Flags [P.], seq 1:77, ack 1, win 512, options [nop,nop,TS val 2705532833 ecr 2705532833], length 76: HTTP: GET / HTTP/1.1
14:11:40.025301 lo    In  ifindex 1 00:00:00:00:00:00 ethertype IPv4 (0x0800), length 72: 10.112.131.19.80 > 10.112.131.19.49304: Flags [.], ack 77, win 511, options [nop,nop,TS val 2705532833 ecr 2705532833], length 0
14:11:40.025403 lo    In  ifindex 1 00:00:00:00:00:00 ethertype IPv4 (0x0800), length 305: 10.112.131.19.80 > 10.112.131.19.49304: Flags [P.], seq 1:234, ack 77, win 512, options [nop,nop,TS val 2705532833 ecr 2705532833], length 233: HTTP: HTTP/1.1 200 OK
14:11:40.025413 lo    In  ifindex 1 00:00:00:00:00:00 ethertype IPv4 (0x0800), length 72: 10.112.131.19.49304 > 10.112.131.19.80: Flags [.], ack 234, win 511, options [nop,nop,TS val 2705532833 ecr 2705532833], length 0
14:11:40.025429 lo    In  ifindex 1 00:00:00:00:00:00 ethertype IPv4 (0x0800), length 684: 10.112.131.19.80 > 10.112.131.19.49304: Flags [P.], seq 234:846, ack 77, win 512, options [nop,nop,TS val 2705532833 ecr 2705532833], length 612: HTTP
14:11:40.025433 lo    In  ifindex 1 00:00:00:00:00:00 ethertype IPv4 (0x0800), length 72: 10.112.131.19.49304 > 10.112.131.19.80: Flags [.], ack 846, win 507, options [nop,nop,TS val 2705532833 ecr 2705532833], length 0
14:11:40.025464 lo    In  ifindex 1 00:00:00:00:00:00 ethertype IPv4 (0x0800), length 72: 10.112.131.19.80 > 10.112.131.19.49304: Flags [F.], seq 846, ack 77, win 512, options [nop,nop,TS val 2705532834 ecr 2705532833], length 0
14:11:40.025465 lo    In  ifindex 1 00:00:00:00:00:00 ethertype IPv4 (0x0800), length 72: 10.112.131.19.49304 > 10.112.131.19.80: Flags [F.], seq 77, ack 846, win 512, options [nop,nop,TS val 2705532834 ecr 2705532833], length 0
